,name,instructions,ingredients
143,Creamy Parmesan Italian Sausage Soup,"Cook the sausage and onion in a large saucepan until cooked, breaking the sausage apart as it cooks, before draining any excess grease. Add the garlic, fennel, and red pepper flakes, mix, and cook until fragrant, about a minute. Add the broth, tomatoes, pasta, and Italian seasoning, bring to a boil, reduce the heat and simmer until the pasta is cooked, al-dente, about 6-8 minutes. Add the parmesan, cream cheese, and cream, and let the cheeses melt into the soup, about 3-5 minutes. Season with salt and pepper to taste, mix in the parsley and enjoy!","1 pound Italian sausage, casings removed; 1 onion, diced; 2 cloves garlic, chopped; 1/2 teaspoon ground fennel (optional); 1/2 teaspoon red pepper flakes (optional); 4 cups chicken broth; 1 (14.5 ounce) can petite diced tomatoes; 8 ounces pasta such as ditalini (gluten-free for gluten-free); 1 teaspoon Italian seasoning; 1/2 cup parmigiano reggiano (parmesan), grated; 4 ounces cream cheese (warmed); 1/2 cup heavy/whipping cream; salt and pepper to taste; 1 tablespoon parsley, chopped (optional)"
144,Aperol Margarita,"Salt the rim (optional). Run a lime wedge (the juicy part) around the top rim of your serving glass. Fill a shallow bowl or plate with salt, then dip the rim until it is covered with your desired amount of salt. Set aside. Make the margarita mix. Add tequila, Aperol, lime juice and a few ice cubes to a cocktail shaker. Cover and shake vigorously for about 10 seconds. Serve. Fill the prepared serving glass with ice. Strain in the margarita mix, garnish with an orange or lime slice, serve and enjoy. Cheers!","2 ounces tequila; 1 ounce Aperol; 1 ounce lime juice; ice; Tajín and coarse salt, for rimming the glass"
145,Pesto-Chicken Penne Casseroles,"Cook pasta according to package directions. Meanwhile, in a large bowl, combine the chicken, cheese blend, spinach, tomatoes, Alfredo sauce, milk and pesto. Drain pasta and add to chicken mixture; toss to coat. Transfer to 2 greased 8-in. square baking dishes. In a small bowl, combine the bread crumbs, Parmesan cheese and oil; sprinkle over casseroles. Cover and freeze 1 casserole for up to 3 months. Cover and bake the remaining casserole at 350° for 40-45 minutes or until bubbly. To use frozen casserole: Thaw in the refrigerator overnight. Remove from the refrigerator 30 minutes before baking. Cover and bake at 350° for 50-60 minutes or until bubbly.","Penne pasta: You’ll need just a standard 1 pound package of penne pasta for this recipe, something you likely have on hand already.; Cooked chicken: The pre-cooked chicken is best if you cook it fresh and cube it yourself, of course, but you can use store-bought cooked chicken that comes in a can or bag.; Italian cheese blend: Don’t skimp on the cheese. It adds flavor and texture and helps bind other ingredients to the pasta noodles.; Fresh baby spinach: The spinach, wilted down into the dish, works in concert with the pesto, helping ground some of the more potent flavors.; Crushed tomatoes: Often, you want to incorporate the liquid in a can of tomatoes into a recipe, but in this case, it’s best to drain most of the fluids.; Alfredo sauce: Thick, creamy, and rich, Alfredo sauce is the anchor of this dish even though it’s pesto that made it into the title.; Milk: 2% milk does well in this recipe and doesn’t need much more creaminess thanks to the Alfredo sauce, but of course, whole milk is most welcome as well.; Pesto: The recipe as written calls for prepared jarred pesto, but if you’ve got quite the home garden bristling with basil, you can go fresh for an even richer taste.; Seasoned bread crumbs: Just a half cup of seasoned bread crumbs brings a lovely texture and a savory touch to this dish.; Parmesan cheese: Our last and tangiest ingredient, save for the oil in which you’ll combine this classic cheese and those bread crumbs, the Parmesan plays a major role here despite each portion of casserole using just a quarter cup.; Olive oil: What’s to be said about olive oil other than it’s as essential to Italian cooking as water is to all of life?; 1 package (16 ounces) penne pasta; 6 cups cubed cooked chicken; 4 cups shredded Italian cheese blend; 3 cups fresh baby spinach; 1 can (15 ounces) crushed tomatoes; 1 jar (15 ounces) Alfredo sauce; 1-1/2 cups 2% milk; 1 jar (8.1 ounces) prepared pesto; 1/2 cup seasoned bread crumbs; 1/2 cup grated Parmesan cheese; 1 tablespoon olive oil"
146,Strawberry ‘Almond Croissant’ Puff Pastry Tarts,"Preheat the oven to 400 degrees F. Line a large baking sheet with parchment paper. In a medium bowl, add strawberries and sugar and gently stir to coat the strawberries with sugar to bring out the strawberry flavors and juiciness. Set aside for later. In the bowl of an electric mixer (or feel free to use a hand mixer), add the softened butter, sugar and egg yolk and beat on high for 1 minute until well combined. Add the almond flour and almond extract and beat again on high for another 30 seconds until mixture is light and fluffy. Set aside. Lay the sheet of thawed puff pastry on a clean surface lightly dusted with flour and roll out to an approximately 9x13 inch sheet (sometimes they shrink when frozen). Cut the puff pastry into 9 equal rectangles, then lay each piece on the parchment-lined baking sheet, leaving a ½-inch space between each piece. Poke each piece a few times with a fork. Add 1 heaping tablespoon of the almond filling to the middle of each puff pastry and evenly spread towards edges, making a ½-inch border around the edge. Top the filling of each pastry with 3-4 strawberry slices. In a small bowl, whisk the egg with a fork and use a pastry brush to brush on the edges of each puff pastry piece. This will create a nice golden brown crust when baked. Finally, evenly sprinkle almond slices on each piece. Bake for 19-25 minutes until the pastry is golden brown on the edges and crisp. Remove from the oven and allow to cool for 10 minutes. Very lightly dust with powdered sugar, if desired. Serve warm or at room temperature. Enjoy!","For the strawberries:; 8 ounces fresh strawberries, stems removed and cut into ¼-inch slices; 1 tablespoon granulated sugar; For the pastry:; 3 tablespoons salted butter, at room temperature*; ¼ cup (50g) granulated sugar; 1 egg yolk; ½ cup (60 grams) fine blanched almond flour; 1 teaspoon almond extract; All purpose flour for dusting; 1 puff pastry sheet, defrosted; Topping and garnish:; 1 large egg; ⅓ cup (37g) sliced raw almonds; 1-2 tablespoons powdered sugar, for dusting (optional)"
147,Roast vegetable megamix,"Preheat your oven to 190ºC/375ºF/gas 5. Bring two large pans of salted water to the boil. Scrub the beets, then place in one of the pans - keep them separate to stop the rest of your veg turning red! Parboil for 20 to 25 minutes. Meanwhile, peel the carrots and parsnips, then chop any bigger ones in half along with the turnips. Trim and quarter the fennel. Place the prepped veg together in the second pan and parboil for 10 minutes. Drain all the veg and leave to steam dry, then separate them out so you can hit them with those different flavours. Toss the beets with the balsamic vinegar and whole herb sprigs. Toss the carrots with the clementine juice and throw in the squeezed halves, then pick over the rosemary leaves. Toss the parsnips with the vinegar and tear over the sage leaves. Reserve the honey for later. Toss the turnips with the vinegar and bay. Toss the fennel with the lemon juice, then pick over the thyme leaves. Lay them out on a large tray, keeping each veg type together. If you're making this ahead, you can get up to this stage the day before, then cover them with tin foil and keep them with your spuds till your turkey is resting. Nothing will discolour because of the oil and acid. Roast for 50 minutes to 1 hour, or until golden, crispy and beautiful. About 5 minutes before the veg are ready, drizzle the honey over the parsnips. Once ready, give the tray a jiggle, then pile the veg on a platter.",olive oil; BEETS; 350 g beetroot; 2 lugs of balsamic vinegar; a few sprigs of fresh oregano or marjoram; CARROTS; 500 g carrots; 1 clementine; a few sprigs of fresh rosemary; PARSNIPS; 400 g parnsips; a lug of white wine vinegar; 2–3 sprigs of fresh sage; 1 small teaspoon runny honey; TURNIPS; 350 g baby turnips; 2 lugs of red wine vinegar; 5 fresh bay leaves; FENNEL; 2 bulbs of fennel; ½ a lemon; a few sprigs of fresh thyme
148,Homemade Lemonade,"Combine sugar and 2 cups water in a saucepan over medium heat. Bring to a boil and stir until sugar has dissolved. Remove from heat and cool to room temperature.  Strain the lemon juice through a fine-mesh sieve into a 2-quart pitcher. Add simple syrup and stir to combine. Refrigerate until cold. When ready to serve, add 2 ½ cups of cold water and stir. Taste, and add more water if it's too sweet. Serve over ice, if desired.",2 cups granulated sugar; 1 1/2 cups fresh lemon juice; 4 ½ – 5 cups water
149,Sunshine Tropical Turmeric Smoothie,"Add all ingredients to a high powered blender: banana, mango, pineapple, coconut milk, turmeric, ginger, lemon zest and lemon juice. Feel free to add any optional add-ins to your smoothie if you’d like. Blend until smooth, adding more milk to thin, if necessary. Pour into a glass and enjoy! Serves 1. Feel free to double the recipe to serve 2.","1 frozen ripe banana; ¾ cup frozen diced mango; ¾ cup frozen pineapple chunks; 1 ¼ cup light coconut milk, plus more to thin as necessary; 1 tablespoon fresh grated turmeric (or ½ teaspoon ground turmeric); 1 teaspoon lemon zest; 1 tablespoon fresh lemon juice; Optional add-ins:; 1-2 teaspoons fresh grated ginger; 1 cup spinach"
150,Copycat Waffle House Waffles,"Stir together flour, cornstarch, salt, baking soda, and baking powder in a large bowl; set aside. Whisk together egg, sugar, butter, shortening, and vanilla in a seperate bowl until well combined; stir in milk, half-and-half, and buttermilk until combined and smooth. Fold flour mixture into milk mixture until just combined (some lumps may remain). Preheat a waffle iron according to manufacturer’s instructions. Spray with cooking spray, and spoon about 1/2 cup batter into waffle iron. Cook according to manufacturer’s instructions until golden brown and crispy, about 4 to 6 minutes. Serve immediately topped with butter and maple syrup.","1 ½ cups (about 6 3/8 ) all-purpose flour; ¼ cup cornstarch; 1 teaspoon kosher salt; ½ teaspoon baking soda; ½ teaspoon baking powder; 1 large egg, lightly beaten; ⅓ cup granulated sugar; 2 tablespoons unsalted butter, softened, plus more for serving; 2 tablespoons vegetable shortening, softened; ¾ teaspoon vanilla extract; ¾ cup whole milk; ½ cup half-and-half; ½ cup whole buttermilk; Cooking spray; Maple syrup"
151,Summer Salmon Salad,"For the Salmon In a large zip-top bag, combine the marinade ingredients. Add the salmon, zip the top of the bag and give it a quick shake to combine. Refrigerate for at least 1 hour and up to 12. Preheat a cast iron pan or grill to medium high heat. Remove the salmon from the marinade and grill for 3-4 minutes skin side down, then flip and cook for an additional 3 minutes until each side is crispy, but not overcooked. Remove and set aside to rest. Remove the skin and flake the salmon before adding to the salad.  For the Salad Whisk together the vinaigrette ingredients in a small bowl. Combine the shredded lettuce with ½ the vinaigrette and toss to combine.Combine the fruit and corn and toss with the remaining vinaigrette. Taste and adjust salt and pepper as neededDivide the dressed lettuce evenly amongst 6 bowls and top with a hefty portion of the diced Avocado, flaked salmon and fruit/corn mixture.","▢ 2 lemons, juiced; ▢ ½ cup olive oil; ▢ 4 cloves garlic, minced; ▢ Kosher salt and freshly cracked black pepper to taste; ▢ 1 pound  salmon; ▢ 1 lemon, juiced; ▢ 2 tablespoons red wine vinegar; ▢ 2 cloves garlic, finely chopped; ▢ 1 small shallot, finely chopped; ▢ ½  cup olive oil; ▢ kosher salt and freshly cracked black pepper; ▢ 1 cup diced peaches; ▢ 1 cup diced nectarines; ▢ 1 cup charred corn; ▢ ½ cup diced strawberries; ▢ 2 avocados diced; ▢ 2 heads romaine lettuce shredded"
152,Spinach and Artichoke Pan Pizza,"Make the dough: In a large bowl, whisk together the flour, salt, and yeast. Add the water and olive oil and use a spoon or dough whisk (I have this one) to bring it together, stirring the mixture a few times to ensure there are no unmixed pockets of flour. Cover the bowl with plastic wrap and let it rise until it doubles and moves a lot when jiggled, about 1 1/2 to 2 hours at room temperature. If you won’t need the dough until later, you can transfer it to the fridge a little before it’s fully doubled and let it finish there for a few hours or overnight. Assemble the pizza: Heat your oven to 450°F (230°C). Coat a 12-inch (30-cm) round cast-iron skillet or a 9×13 cake pan with 2 to 3 tablespoons olive oil. Scrape dough into the pan, then turn it over once so it’s oiled on both sides. Dip your fingers in the oil to coat them and dimple the dough out to the edges as best as you can; it’s okay if it doesn’t fully stretch at this point. Set it aside, loosely covered, for 30 minutes to finish proofing. Meanwhile, make the spinach pesto: In a food processor or high-speed blender, combine the scallions and garlic. Add spinach and pulse the machine until it’s well-chopped. Drizzle in olive oil until the mixture looks thick but loosened — usually it needs 4 to 6 tablespoons. Season well with salt and red pepper flakes to taste. To assemble: Being careful not to deflate the dough, use oiled fingers to gently dimple the dough out to the edges of the pan if it’s not there already. Spoon half of the spinach pesto mixture over the dough, and use the back of the spoon to gently spread it out. The toppings should go all the way to the pan’s edge when making this pizza, i.e. do not leave an empty border. Arrange the artichoke hearts over the spinach pesto, then finely grate some of the lemon zest over. Sprinkle mozzarella, parmesan, and fontina, then season the pizza with salt, red pepper flakes, and a little more lemon zest. Bake the pizza: For 25 to 30 minutes, until deeply golden brown at the edges and toasty on top. Yes, this baking time and temperature is correct. It sounds very long but I’ve made a hundred of these pizzas and always regret when I take it out before 30 minutes, as the edges have a less satisfying crunch. To serve: Finish with lemon juice. You can serve it right in the pan, but I prefer to protect my knives and loosen the pizza from the pan and slide it onto a cutting board before cutting it into wedges or squares. Do ahead: Leftovers reheat fantastically. I heat leftover slices on a foil-covered sheet pan at 350°F or 375°F for 15 minutes. Leftover spinach pesto keeps for up to 5 days in the fridge.","Dough; 2 cups (260 grams) all-purpose flour; 1 teaspoon instant yeast; 1 teaspoon kosher salt (I use Diamond brand kosher salt; use half of other brands); 1 cup lukewarm water (100° to 115°F); 1 tablespoon (15 grams) olive oil; Spinach Pesto; 2 thick or 3 thin scallions, thinly sliced; 2 garlic cloves, minced; 4 ounces (115 grams) spinach leaves, baby spinach is fine; Red pepper flakes, to taste; Olive oil; Assembly; 1 14-ounce can quartered artichoke hearts, drained and patted dry; Zest and juice from half a lemon; 6 ounces (170 grams) mozzarella, diced from a block or perlini (as shown here); 1/2 cup (45 grams) grated parmesan; 1/2 cup (55 grams) grated fontina or asiago cheese"
153,Protein Ice Cream (Chocolate or Vanilla),"Blend: Add all ingredients to a high powered blender or food processor and blend until smooth. (See notes for Ninja Creami Instructions). Freeze: Spoon into a freezer friendly container, cover, and freeze for at least 1-3 hours, or until frozen.  Scoop and enjoy!",2 frozen bananas; ¼ cup cottage cheese; Pinch salt; 1 scoop protein powder; 2 Tablespoons unsweetened cocoa powder; 2 teaspoons vanilla extract
154,Blackberry and Coconut Macaroon Tart,"Make base: Preheat oven to 350°F with a rack in the middle of the oven. Line the bottom of a 9-inch round tart pan with a removable bottom or an 8-inch square baking pan with parchment. Generously butter parchment and sides of pan. Combine flour, coconut, sugar and salt in a medium bowl. Stir in melted butter until evenly distributed in dry ingredients. Press mixture firmly in the bottom of the pan to form a solid, flat layer, like a shortbread cookie base. Bake for 15 minutes, or until lightly golden. Remove and set aside to cool for a few minutes while you prepare the filling. Assemble tart: Stir together coconut, sugar and egg whites. Evenly distribute blackberries across tart base. Using a small spoon or your fingertip, drop little tufts of macaroon filling around the blackberries, allowing them to stay at least partially uncovered. Bake for 20 to 25 until the peaks of the macaroon filling are bronzed. Let tart cool, then garnish with the crushed pistachios (I pressed mine in just a little bit, so they’d stick better) before slicing into skinny wedges or small squares.","Crust; 1 cup plus 2 tablespoons white whole wheat flour, spelt flour or matzo cake meal; 1/2 cup plus 1 tablespoon unsweetened finely shredded coconut; 1/2 cup plus 1 tablespoon natural cane sugar (I used a coarse Turbinado because I had it on hand); Generous 1/4 teaspoon fine grain sea salt; 6 tablespoons unsalted butter, melted; Filling; 1 1/2 cups unsweetened finely shredded coconut; 6 tablespoons natural cane sugar or lightly packed light brown sugar; 3 large egg whites; 6 ounces fresh blackberries, halved (feel free to swap any berry/cherry you can find in season); 1/4 cup pistachios, crushed"
155,Street Corn Salad (Esquites),"Shave kernels from corn cobs into a mixing bowl with a sharp knife. Mince cilantro and (if using) dice jalapeños and onions into small pieces. Gather dressing ingredients: mayonnaise, Greek yogurt, smoked paprika, cayenne pepper, chili powder, and sea salt. Zest and juice lime. Whisk all dressing ingredients together until smooth. In a very hot skillet, add corn kernels and stir them every 30 seconds or so just until there’s a good mix of toasty corn kernels present. You do not need to cook them for long or add any oil, you just want some color on the kernels. Remove from skillet and pour into large serving bowl. Toss toasted corn, cotija cheese, cilantro and dressing together until well combined. (Add diced pickled onions and jalapeños if you chose to include them!) This salad can be enjoyed warm or chilled with an extra sprinkle of chili powder on top if you like it spicy! Enjoy.  ","3 Tbsp mayonnaise; 2 Tbsp plain Greek yogurt; 1 lime; ¼ tsp smoked paprika; ⅛ tsp cayenne pepper; ¼ tsp chili powder; ¼ tsp sea salt; 5 ears of corn, husked*; ¼ cup fresh cilantro; 3 Tbsp cotija cheese**; 2 Tbsp pickled red onion; 1 Tbsp pickled jalapeño"
156,Air Fryer Smashed Potatoes,"Clean the potatoes and place the potatoes in a pot of salted water, covering about 1 inch above. Cook potatoes until soft, about 20-25 minutes. Drain the potatoes and allow to cool for 5 minutes. Transfer to a cutting board or large sheet pan and gently smash the potatoes using a potato masher, or the bottom of a cup, until flattened to about 1/2 inch thick. In a small mixing bowl, combine the melted butter, oil,  garlic, and parsley. Brush the potatoes with the garlic butter mixture. Generous sprinkle with salt & pepper. Preheat air fryer to 400ºF. Transfer the potatoes to the air fryer basket in a single layer. Cook for 15 minutes or until the potatoes are crispy and golden."," 1 pound Yukon or baby gold potatoes;  2 tablespoons butter, melted;  1 tablespoon oil;  3-4 cloves garlic, minced;  1 tablespoon finely chopped fresh parsley;  salt & pepper, to taste"
157,Crispy Air Fryer Chicken Wings,"Pat the chicken wings dry with a paper towel. Make sure to get as much moisture off the skin as possible. Mix 1 teaspoon of salt with 1 teaspoon of baking powder per pound of chicken. Toss the dried chicken wings in this mixture until evenly coated. Place the wings on a rack set over a sheet pan and refrigerate for at least an hour.  Remove the wings from the fridge and pat them dry a second time. Mix the cornstarch, garlic powder, smoked paprika, onion powder, and black pepper called for in the recipe for every pound of chicken. Toss the wings in this mixture until thoroughly coated. Grease your air fryer basket and preheat it to 300°F. Arrange the wings in a single layer, making sure they do not touch. Cook for 15 minutes. Flip the wings over, raise the temperature of the air fryer to 450°F, and cook for 10 minutes. Use a meat thermometer to make sure the wings have an internal temperature of 165°F before serving.",1 lb chicken wings; 1 tsp coarse salt*; 1 tsp baking powder*; 1 tsp cornstarch; 1/2 tsp garlic powder; 1/2 tsp smoked paprika; 1/4  tsp onion powder; 1/8 tsp black pepper; 1/8 tsp cooking oil for greasing
158,Fajita Veggie and Halloumi Bowls,"Preheat the oven to 425 degrees Fahrenheit. Line two large, rimmed baking sheets with parchment paper. Bring a large pot of water to boil over high heat for the rice.  Slice the peppers and onion into ½-inch wide long strips, keeping the chunks of onion intact as best you can.  Place the peppers and onion on one prepared baking sheet. Drizzle them with the olive oil, chili powder, cumin, garlic powder, salt and pepper (save the lime juice for later). Toss until all of the ingredients are lightly coated, then arrange them in an even layer across the pan. Rearrange any single onion pieces from the outer edges to the interior of the pan, as they tend to burn otherwise. Bake the peppers and onions on the middle rack for 15 minutes.  Once the pot of water is boiling, pour in the rice. Give the mixture a brief stir and let it boil for 30 minutes, reducing the heat if necessary to prevent overflow. Drain the rice, return it to the pot, cover, and let it rest for 10 minutes off the heat.  Meanwhile, lightly pat the halloumi dry. Slice the halloumi lengthwise into pieces ¼ to ½ inch thick, then cut or tear the slabs into small, bite-sized pieces about 1-inch long. On the remaining baking sheet, drizzle the halloumi with ½ tablespoon olive oil and sprinkle all over with the optional chipotle powder. Toss until lightly coated, and arrange them in an even layer.  Once the timer goes off for the peppers, remove them from the oven, stir and redistribute. Again move any single onion pieces to the middle, then return the baking sheet to the oven. When you do that, place the pan of halloumi on the top rack. After 10 minutes, stir and flip the cheese, moving any browning pieces more toward the middle. Return it to the oven for up to 5 more minutes, keeping a close eye on it as the cheese tends to brown quickly toward the end. Continue baking the pepper mixture until the peppers and onions are tender and deeply caramelized. They are typically done around the time that the halloumi is finished.  While the peppers are hot out of the oven, drizzle the lime juice on top and stir to combine. Season to taste with additional salt and pepper. To finish the rice, fluff it with a fork, then stir in the cilantro, lime juice, and salt. Add the black beans and gently stir to combine. Cover until you’re ready to serve. To assemble, divide the rice between four bowls, followed by the pepper mixture and cheese. Finish with any desired toppings, and enjoy warm. Leftovers keep well in the refrigerator, covered, for up to 4 days.","3 bell peppers (red, orange or yellow); 1 medium red onion; 2 tablespoons olive oil ; 1 teaspoon chili powder; ½ teaspoon cumin; ½ teaspoon garlic powder; ¼ teaspoon fine salt; 10 twists of freshly ground black pepper; 2 tablespoons lime juice; ½ pound or more* halloumi cheese ; ½ tablespoon olive oil; ¼ teaspoon chipotle powder or smoked paprika (optional, for heat); 1 cup long-grain brown rice or brown basmati rice, rinsed well; 2 tablespoons chopped fresh cilantro; 2 tablespoons lime juice; ½ teaspoon fine salt; 1 can (15 ounces) black beans, rinsed and drained, or 1 ½ cups cooked black beans; Topping suggestions: Fresh cilantro, sliced avocado or dollops of guacamole, halved cherry tomatoes, sour cream"
