,name,instructions,ingredients
398,How to Grill Pizza,"Preheat the grill to about 400 to 500 degrees Fahrenheit (if your grill doesn’t have a temperature gauge, you’ve reached this temperature when you can comfortably hold your hand about 5 inches above the grate for just one second—be careful!).  On a floured surface, prepare the dough through step 5. Lightly brush the top of the dough all over with olive oil. Scoop one round of dough onto a pizza peel (in a pinch, use a flat cookie sheet with no rim).  Carefully flip the dough onto the preheated grill so that the oiled side is against the grate. Close the grill and cook until the dough is bubbling all over and lightly cooked through, about 2 to 3 minutes.  Scoop the pizza crust back onto your pizza peel, then place the pizza on a flat surface and add your toppings: divide half of the sauce over the pizza and spread it around, leaving about 1-inch bare along the edges, followed by half of the cheese, and any toppings you desire.  Return the pizza to the grill, cover the grill, and cook until the cheese is melted, about 2 to 4 minutes. Scoop the pizza back onto your pizza peel and  transfer it to a flat cutting surface.  Add any remaining toppings (like arugula, balsamic reduction and red pepper flakes, as shown in photos). Repeat the process with the second pizza. Slice and serve! Leftover pizza will keep well in the fridge, covered, for up to 5 days.","1 batch easy whole wheat pizza dough or 1 pound store-bought pizza dough; 1 cup pizza sauce or pesto; 8 ounces (2 cups) freshly grated low-moisture part-skim mozzarella cheese or goat cheese, crumbled; Toppings of your choice*"
399,Chow Mein,"Chow mein sauce: In a small bowl, whisk the sauce ingredients together and set aside. Cook chicken: Heat a large pan or wok on high heat. Add 1 tablespoon oil. Season chicken with salt and pepper and add to hot pan. Sauté until cooked through, then remove to a plate. Cook Veggies: Add another tablespoon of oil. Once hot add cabbage, carrots, celery, and the whites of the chopped green onion. Stir fry over high heat for 1-2 minutes. Add the garlic and ginger and cook for 30 seconds, then remove everything to a plate. Noodles: Add last tablespoon of oil to the pan and add the noodles. Cook for 1 minute. Add the sauce and cook, tossing to coat. Return veggies and chicken to the pan, along with fresh bean sprouts. Serve immediately, garnished with green onion.",14 oz yakisoba refrigerated noodles; 1 lb boneless skinless chicken breasts; salt and pepper; 3 Tablespoon vegetable oil; 2 cups finely shredded cabbage*; 1 large carrot; 2 ribs celery; 4 green onions; 3 cloves garlic; 2 teaspoons freshly grated ginger; 1 cup fresh bean sprouts; 1/4 cup oyster sauce; 1/3 cup low-sodium soy sauce; 2 Tablespoons sesame oil; 1 Tablespoon rice vinegar; 1 teaspoon cornstarch; 1 Tablespoon light brown sugar; 1-2 teaspoons Asian Garlic Chili Sauce
400,30 Minute Broccoli Cheddar Soup (Better than Panera!),"Melt butter in a large dutch oven or pot over medium-high heat. Add the onion and cook 3-4 minutes or until softened and light gold. Add the garlic and saute for another minute. Add flour and whisk for 1-2 minutes or until the flour begins to turn golden in color. Pour in the chicken stock, broccoli florets, carrots, and seasoning. Bring to a boil then reduce heat to medium-low and simmer for 15 minutes or until the broccoli and carrots are cooked through. Stir in half & half and cheddar cheese and simmer for another minute. Taste and adjust seasoning if needed. Serve with toasted crusty bread or in a bread bowl if desired."," 4 tablespoons butter, ½ stick;  ½ medium onion, chopped;  2-3 cloves garlic, minced;  4 tablespoon AP flour;  2 cups low sodium chicken or vegetable stock;  1 tsp kosher salt;  ½ tsp black pepper;  ¼ tsp paprika, or ground nutmeg, optional;  3 cups broccoli florets, or 1 large head, cut into small pieces;  1 large carrot, grated, julienned or finely chopped;  2 cups half & half, or milk or light or heavy cream;  8 oz block grated cheddar cheese, or 2 cups (mild, medium, or sharp )"
401,Poached chicken,"Peel and halve the onions, then chop the leeks, celery and carrots into large chunks. Halve the garlic bulb around the equator. Put all the ingredients in a large pan with a pinch of sea salt, then cover with cold water. Place on the hob over a medium heat and bring just to the boil. Reduce the heat to a low simmer, skimming off any scum that rises to the top. Simmer gently for about 1 hour, or until the juices run clear when you pierce the meat. Remove the bird from the pan and bubble the poaching liquid for 40 minutes, or until reduced by about one-third (to add more flavour, you could strip the meat from the chicken and return the bones to the stock, too). Sieve the stock, then store in the fridge for up to 1 week.",2 large onions; 1-2 leeks; 4 celery stalks; 4 carrots; 1 bulb of garlic; 1 x 1.7 kg free-range chicken; 3-4 fresh bay leaves; 3 sprigs of fresh tarragon; 1 large bunch of fresh parsley (or just stalks if you’re using leaves for something else); 1 teaspoon whole black peppercorns
402,Zucchini Butter Spaghetti,"Boil your spaghetti in well-salted water until it’s 1 minute shy of fully cooked. Before you drain it, reserve 1 cup of the pasta cooking water and set it aside. Melt butter in your empty pan over medium-high heat and add the garlic, stirring it into the butter for one minute before adding the zucchini, salt, and red pepper. Cook the zucchini, stirring from time to time, for 13 to 15 minutes. It will first let off a puddle liquid, the liquid will cook off, and the zucchini will become soft and concentrated. If the zucchini begins to brown, reduce the heat slightly. Stir frequently for 2 more minutes, chopping it down into smaller bits with the edge of your spoon or spatula, until it reaches an almost spreadable consistency. Pour in 1/2 cup of the reserved pasta water and stir up anything stuck, then add drained pasta, and cook together for 2 minutes. Use tongs or two forks to pull up the zucchini butter sauce into the pasta strands, tossing frequently, and adding some or all of the remaining pasta water as needed to loosen. Toss in half of the parmesan and basil and mix, then transfer to a serving bowl. Finish with remaining parmesan and basil.","1 1/2 teaspoons kosher salt, plus more for pasta water, and to taste; 8 ounces (225 grams) spaghetti, cooked al dente; 1 cup (235 ml) pasta water, reserved; 1 1/4 pounds (570 grams) zucchini, trimmed, coarsely grated; 6 tablespoons (85 grams) unsalted butter; 4 garlic cloves, minced; 1/4 teaspoon red pepper flakes, or more to taste; 1/2 cup (45 grams) grated parmesan; Handful fresh basil leaves, cut into thin ribbons; "
403,Spicy Chicken and Avocado tacos with Creamy Cilantro Lime Sauce,"Chop 2-3 medium chicken breasts into small bite-size pieces. In a medium bowl whisk together olive oil, garlic, chili, cumin, onion powder, and salt. Add in chicken and toss to coat completely. Cover and refrigerate for at least 10 minutes or up to 48 hours. To cook: Heat a large heavy-duty or cast iron skillet on high heat for 1 minute. Add the olive oil and chicken. Cook chicken in a skillet over medium-high heat until charred and cooked through, 8-12 minutes. Turn off heat and finish with a squeeze of lime (optional). Add the sour cream, cilantro, garlic, lime juice and salt & pepper to blender or food processor. Blend for 30 seconds to 1 minutes or until creamy. Char tortillas on stove-top if desired. Add some of the chicken to the warmed tortillas. Top with avocado and cilantro sauce."," 1 pound chicken breasts, cut into bite size pieces;  2 tbsp olive oil;  2 clove garlic , crushed or minced;  1 tbsp chili powder;  1/2 teaspoon ground cumin;  1/4 teaspoon onion or garlic powder ;  1/4 teaspoon kosher salt;  1 tbsp olive oil;  squeeze of lime, optional ;  1/2 cup sour cream, or Greek Yogurt or Mayo;  1/4  cup cilantro;  1 clove garlic;  1  teaspoon lime juice;  salt and pepper , to taste;  2 avocados, sliced ;  6-8 small tortillas , corn or flour "
404,Broccoli Stuffed Chicken Breasts,"To steam broccoli: Chop the broccoli florets into small pieces. Put all the broccoli in a microwave-safe bowl and about 2 tablespoons water. add water.  Cover with plastic wrap and microwave on high for 2-3 minutes. Alternatively, steam on stove-top or blanch in boiling water for 1 minute. Use a sharp knife to slice each chicken breasts horizontally to form a pocket. Be sure not stop cutting about 1/2 inch from the ends and sides. Season chicken breasts with a generous sprinkle of Italian seasoning, garlic powder, paprika, salt, and pepper. In a large bowl, combine the steam and chopped broccoli, bell pepper, garlic, cheeses and salt & Pepper; set aside. Spoon the mixture into each chicken breast evenly. Secure with toothpicks if needed. Preheat oven to 400F. Heat 1 tablespoons oil in a large cast iron or oven-safe pan over medium-high heat. Add the chicken breasts and cook for 2-3 minutes per side or until golden. Cover with aluminum foil and transfer to preheated oven for 15-20 minutes or until cooked through."," 4 chicken breasts;  1 teaspoon Italian seasoning, optional;  1 teaspoon paprika, optional;  1/2 teaspoon garlic powder;  1 teaspoon salt ;  1/2 teaspoon black pepper;  1 tablespoon olive oil;  2 cups broccoli florets ;  1/4 cup bell pepper, minced;  1/2 cup cheddar cheese, or melting cheese of choice;  4 ounces cream cheese, softened;  ¼ cup grated Parmesan;  2 cloves garlic, minced;  salt and pepper"
405,The Perfect Pot of Rice,"Rinse 1 cup rice in a fine-mesh sieve until the water runs clear. (This may take up to a minute. Alternatively, you can rinse rice in a bowl or pot with several changes of cold water, draining carefully between rinses, but we think the strainer method is the least annoying.) Combine rice, ½ tsp. Diamond Crystal or ¼ tsp. plus ⅛ tsp. Morton kosher salt, and 1¼ cups cold water in a medium saucepan. Give everything a gentle stir. Bring to a boil, then cover pot with a tight-fitting lid and reduce heat to low, aiming for the lowest possible flame. Cook rice over low heat, undisturbed—that means not opening the lid!—for 18 minutes. Remove pan from heat. Let stand at least 15 minutes or until ready to use. Uncover and fluff cooked rice with a fork before serving. Editor’s note: This stovetop rice recipe was first printed in our June 2012 issue. Head this way for more of our best rice recipes →","1 cup short-grain, medium-grain, or long-grain white rice (not parboiled, converted, or quick-cooking); ½ tsp. Diamond Crystal or ¼ tsp. plus ⅛ tsp. Morton kosher salt"
406,Pan-Seared Filet Mignon,"Sprinkle fillets with pepper and salt. Melt butter with olive oil in a large stainless steel or cast-iron skillet over medium heat. Add fillets, and cook 5 to 7 minutes on each side or to desired degree of doneness. Let stand 5 minutes.",4 (6-oz.) beef tenderloin fillets; 1 teaspoon freshly cracked pepper; ½ teaspoon kosher salt; 2 tablespoons butter; 2 tablespoons olive oil
407,Watermelon Salad with Herbed Yogurt Sauce,"In a small bowl, combine the sliced shallot with the vinegar and ¼ teaspoon salt. Toss to combine, and place in the refrigerator to lightly pickle while you prepare the rest of the salad. Make the yogurt sauce: In a food processor, combine the yogurt, fresh herbs, olive oil, honey, and a pinch of salt. Blend until the herbs are broken into tiny pieces and the sauce is pale green. (If you don’t have a food processor, finely chop the herbs and whisk the ingredients together in a bowl.) Swirl the yogurt sauce (all of it) over the base of a large serving platter. Scatter the cubed watermelon on top, followed by the cucumber. Arrange the pickled shallot on top, and spoon the leftover vinegar over the salad. Drizzle 2 tablespoons olive oil on top, sprinkle generously with fresh herbs, and season with salt and pepper, to taste. If you won’t be serving immediately, place the salad in the refrigerator to stay chilled. This salad is best served within an hour or two.","Watermelon salad; 3 pounds ripe seedless watermelon (about ½ small round watermelon or 4 cups cubed), cut into ¾″ cubes; 2 mini cucumbers or 1 small cucumber, thinly sliced into rounds; ½ cup thinly sliced shallot (1 medium-to-large shallot); 3 tablespoons sherry vinegar or red wine vinegar; ¼ teaspoon fine sea salt; 2 tablespoons extra-virgin olive oil; Small handful fresh mint and basil leaves, torn if large, for garnish; Flaky sea salt or kosher salt, to taste; Freshly ground black pepper, to taste; Herbed yogurt sauce; 1 cup Greek yogurt; ⅓ cup lightly packed combination of fresh basil and fresh mint leaves; 1 tablespoon extra-virgin olive oil; 1 teaspoon honey or maple syrup; Pinch of fine sea salt"
408,Zucchini Muffins,"Preheat the oven to 350°F. Next wash the zucchini well, trim off the stem of the zucchini, then using the large holes on a box grater, grate the zucchini and set it to the side. In a large bowl, whisk together the dry ingredients (flour, baking powder, baking soda, salt, and cinnamon) until well combined. In a separate bowl, whisk together the wet ingredients (eggs, granulated sugar, brown sugar, applesauce, oil and vanilla extract) until well combined. Add the grated zucchini to the bowl with the wet ingredients. Stir until combined.  Pour the wet ingredients into the same bowl as the dry ingredients. Stir together until just combined. Be careful not to overmix at this point. Divide the batter between eight greased or lined muffin wells. Bake the muffins for about 24 minutes or until golden brown and puffed in the center. Allow the muffins to cool for about 5 minutes, then carefully loosen the edges with a knife and transfer the muffins to a wire rack to finish cooling. Enjoy!",2 cups grated zucchini (about 1 lb.); 2 cups all-purpose flour; 1 tsp baking powder; 1/2 tsp baking soda; 1/2 tsp salt; 1 tsp cinnamon; 2 large eggs; 1/2 cup granulated sugar; 1/2 cup brown sugar; 1/3 cup sweetened applesauce; 1/4 cup cooking oil; 1 tsp  vanilla extract
409,Creamy Lasagna Soup,"Heat a large pot or deep pan to medium-high heat. Add the ground beef, onion, garlic, and spices. Sauté for 4-5 minutes or until beef is browned and cooked through. Add the marinara sauce and sauté for another 2-3 minutes. Next, add the chicken broth and bring it to a boil, then add the broken lasagna noodles to the pot. Reduce the heat and let it simmer until the noodles are tender about 10- 12 minutes. Stir in the heavy cream, mozzarella, and parmesan cheese just until the cheese has melted then turn off the heat. Serve immediately with a dollop of ricotta cheese if desired. Garnish with basil and more parmesan and enjoy!"," 1 pound ground beef;  1 onion, diced;  4-5 cloves garlic, minced;  1/2 teaspoon EACH salt, garlic powder, oregano or Italian seasoning, red pepper flakes;  1/4 teaspoon black pepper;  24 oz marinara sauce;  4 cups chicken broth or water;  8 lasagna noodles, uncooked and broken into rough 3″ pieces;  1 cup heavy cream;  ½ cup shredded mozzarella cheese;  1/2 cup grated Parmesan, optional;  ½ cup ricotta cheese, optional;  1/4 cup basil, chopped (optional)"
410,Ranch Water Cocktail,Fill a tall glass to the brim with ice. Pour in the tequila and lime juice. Add a tiny sprinkle of salt to bring out the flavors.  Fill the rest of the glass with sparkling water. Gently stir once with a spoon to mix. Add a lime wedge and serve at once. ,"1 ½ ounces silver (blanco) tequila; 1 ounce fresh lime juice, plus lime wedges for serving; Teeny tiny pinch of fine salt ; Sparkling water, preferably Topo Chico or Mineragua"
411,Homemade cinnamon crumpets,"Place all the crumpet ingredients into a food processor, add 2 teaspoons of sea salt and 600ml of tepid water and blitz to a loose batter. Leave to stand for 10 minutes to let the yeast develop – the mixture should be quite wet, just about dropping consistency. Meanwhile, make the topping. Finely grate the lemon zest into a bowl, add ricotta and honey, then beat together until light and fluffy. Mash half the raspberries with a fork and ripple through the ricotta. Grease the inside of the metal rings with oil, then place in a non-stick frying pan on a medium heat – work in batches, according to the number of metal rings you have. When the pan’s nice and hot, spoon some mixture into each ring, so it’s roughly 1cm deep. Turn the heat down to low and leave for 15 minutes to cook through – keep an eye on them and reduce the heat slightly, if you think the bottoms are getting too dark. When the time’s up, bubbles and crumpet-like dimples should have formed on the top — turn the crumpets over, using tongs to lift the rings away. Cook for another 5 to 10 minutes, or perfectly golden. Serve the crumpets warm with a generous spoonful of ricotta, a scattering of fresh raspberries and an extra drizzle of honey, if you like.","CRUMPETS; 500 g strong white bread flour; 1 teaspoon caster sugar; 1 x 7g sachet of yeast; 1 pinch of bicarbonate of soda; ½ teaspoon ground cinnamon; TOPPING; 1 lemon; 250 g ricotta cheese; 2 tablespoons runny honey , plus extra for drizzling; 3 large handfuls of fresh raspberries; vegetable oil , for greasing"
412,Good old French bean salad,"Bring a pan of water to a fast boil, add your beans, put a lid on the pan, and cook for at least 4 to 5 minutes. Boiling the beans fast like this helps them to retain all their nutrients. Meanwhile, put the mustard and vinegar into a jam jar or bowl and, while stirring, add the olive oil to make a good hot French dressing. Season carefully with sea salt and freshly ground black pepper, then add the finely chopped shallot, the capers if you're using them and the garlic. Remove one of the beans from the pan to check if it's cooked. If it holds its shape but is also soft to the bite, it's perfect. Drain in a colander. Now, while the beans are steaming hot, this is the perfect moment to dress them – a hot bean will take on more of the wonderful dressing than a cold one. It is best to serve the beans warm, not cold, and certainly not at fridge temperature because the flavours will be muted and boring. Serve the beans in a bowl, sprinkled with chervil if you like – it's a delicate, crunchy herb that goes well with beans. Serve as a salad in its own right, or as an accompaniment to a main meal.","4 handfuls French beans , stalk ends removed; 2-3 heaped teaspoons French mustard , to taste; 2 tablespoons good-quality white wine vinegar; 4 tablespoons extra virgin olive oil; sea salt; freshly ground black pepper; 1 medium shallot , peeled and finely chopped; 1 tablespoon capers , optional; ½ clove garlic , finely grated; 1 small handful fresh chervil , optional"
413,Chicken Pesto pasta,"Begin by cooking the pasta in a large pot according to package directions. Add the broccoli into the pasta pot 1 minute before turning off the heat. Drain, set aside. While the pasta is cooking, Pour 1 tablespoon oil into a large pan. Add the onion and cook for 3-4 minute or until golden. Add the garlic and cook for just a few seconds then add the sliced chicken. Season with salt & pepper and cook the chicken for 5-7 minute or until browned. Add the parmesan, cream, pesto, and salt & pepper. Simmer mixture for 2-3 minutes. Add the cooked pasta and broccoli. Stir until fully combined. Simmer for another 2-3 minutes. Remove from heat and garnish with more parmesan. Enjoy!"," 1 tablespoon olive oil;  1/2 onion, minced;  4 cloves garlic, minced;  2 chicken breasts, sliced into ½ inch strips;  1 cup light cream ;  1/4 grated parmesan cheese;  1/4 cup pesto;  1/2 teaspoon salt;  1/4 teaspoon pepper or to taste;  4 cups aldente pasta, drained (appx);  2 cups broccoli florets, frozen or fresh"
414,Mini quiches,"Put the flour into a mixing bowl, cube and add the cold butter, then rub in with your fingers until the mixture resembles fine breadcrumbs. Add 2 tablespoons of cold water and mix until you get a rough dough. Bring the dough into a ball with your hands, then wrap and rest in the fridge for at least 30 minutes. Peel and finely chop the onion and garlic, then place in a large non-stick frying pan on a medium heat with 1 tablespoon of olive oil and cook for 5 minutes, or until soft, stirring regularly. Prep your chosen vegetables – clean and slice the mushrooms, slice the broccoli into very small florets, deseed and finely slice the peppers, finely slice the cherry tomatoes, dice the courgettes. Add the vegetables to the pan (there’s no need to cook the tomatoes) and cook for 3 to 4 minutes, stirring occasionally and adding splashes of water, if needed. Finely chop and add the bacon or ham (if using), and season to perfection. Crack the egg into a jug, pour in the cream and beat with a fork, then grate in most of your chosen cheese. Preheat the oven to 190°C. Dust a clean surface and a rolling pin with flour and roll out the pastry so it’s around the thickness of a £1 coin. Stamp out rounds of pastry using a 10cm pastry cutter and gently push them into the wells of a muffin tray (leftover pastry can be pushed back into a ball and re-rolled). Prick each base with a fork. Pop paper cases inside each well, fill with baking beans or uncooked rice, and blind bake for 15 minutes, removing for the final 5 minutes. Divide the vegetable mixture between the pastry cases, pour over the egg mixture and grate over the rest of the cheese. Bake for 15 minutes, or until golden and just set. Delicious served hot or cold.","125 g plain flour, plus extra for dusting; 65 g unsalted butter , (cold); 1 small onion; 1 clove of garlic; olive oil; 1 handful of your favourite vegetables, such as baby spinach, mushrooms, broccoli, peppers, cherry tomatoes, courgettes, peas; optional: 1 rasher of higher-welfare smoked streaky bacon or 1 slice of smoked higher-welfare ham; 1 large free-range egg; 100 ml single cream; 60 g your favourite cheese, such as Cheddar, Stilton, feta, goat’s cheese"
415,Grilled Brie,"Soak a cedar plank in water for at least 30 minutes, up to 4 hours. This will keep it from burning. Preheat your grill to medium high. Place your cheese on the plank. Place plank on top of the grate. Grill with lid closed for 7-8 minutes. Add honey and nuts over the top, and grill for another 2 minutes to warm through. Remove from grill and serve warm directly from cedar plank, or remove to a platter.","7 ounces brie wedge; 3 tablespoons walnuts or pecans, chopped; 3 tablespoons honey"
416,Simple cheese omelette,"Crack the eggs into a mixing bowl, season with a pinch of sea salt and black pepper, then beat well with a fork until fully combined. Place a small non-stick frying pan on a low heat to warm up. Grate the cheese onto a board and set aside. Add ½ tablespoon of oil to the hot pan, then carefully pour in the eggs. Tilt the pan to spread them out evenly, using a fork to swirl the eggs around the pan a little. When the omelette begins to cook and firm up, but still has a little raw egg on top, sprinkle over the cheese. Using a spatula, ease around the edges of the omelette, then fold it over in half. When it starts to turn golden brown underneath, remove the pan from the heat and slide the omelette onto a plate. Delicious with a tomato salad and wholemeal bread. PRINT THIS RECIPE (UK)
PRINT THIS RECIPE (USA)",2 large eggs; olive oil; 10 g Cheddar cheese
417,Air Fryer Chicken Thighs,"Preheat the air fryer to 400°F. In a small bowl, whisk the spices and set aside. To a large bowl, add the chicken thighs and drizzle with olive oil, and sprinkle with the spice mixture. Toss to coat. Transfer to the preheated air fryer and cook for 12 minutes per side or until cooked through and skin is crispy."," 4 bone-in, skin-on chicken thighs, about 2 pounds;  2 tablespoons olive oil;  1 teaspoon EACH smoked paprika, garlic powder, oregano, cumin, salt & pepper"
418,Chicken Caesar Wrap,"Place the olive oil and butter in a small skillet over medium high heat. Add the panko and toast until golden. Season with salt and pepper and set aside.Combine the ingredients for the Tahini Caesar Dressing in a small blender and set aside.Combine the shredded kale and lettuce in a large bowl. Drizzle a few tablespoons of the dressing along with the toasted panko, the everything seasoning and the chopped grilled chicken. Toss to combine. Taste and adjust seasoning and dressing.Place a heading portion into 2 tortillas and wrap and roll. Slice on a diagonal and serve.",▢ ½ cup panko bread crumbs; ▢ 2 tablespoons olive oil; ▢ 1 tablespoon butter; ▢ ½ teaspoon kosher salt; ▢ ½ teaspoon freshly cracked black pepper; ▢ ⅓ cup tahini; ▢ 3 tablespoons fresh lemon juice; ▢ 1 tablespoon olive oil; ▢ 3 cloves garlic roughly chopped; ▢ 2 tablespoons water; ▢ kosher salt; ▢ 1 bunch Tuscan kale ribs removed and shredded; ▢ 1 whole romaine heart shredded; ▢ 3 tablespoons Everything but the Bagel Seasoning; ▢ 2 ripe avocados cut into large wedges; ▢ 2 chicken breasts seasoned with salt and pepper and grilled; ▢ 2 large tortillas
