,name,instructions,ingredients
275,Easy No-Bake Granola Bars,"Line a 9-inch square baker with two strips of criss-crossed parchment paper, cut to fit neatly against the base and up the sides. The parchment paper will make it easy for you to slice the bars later. Place the oats in a large mixing bowl**. Add the cinnamon and salt, and stir to combine. Set aside. Now we’ll blitz the mix-ins briefly in the food processor or blender (or, you can chop them by hand). Add any large nuts (like almonds or pecans) first and blitz for a few seconds. Then add the rest and run the machine for a few more seconds, until the ingredients are all broken up into pieces smaller than your pinky nail. Pour the mix-ins into the bowl of oats. 
In a 2-cup liquid measuring cup, measure out the nut butter. Top with ½ cup honey and the vanilla extract. Stir until well blended. If you must, you can gently warm the liquid mixture on the stovetop or in the microwave, but make sure it’s close to room temperature before you pour it into the dry mixture (this is especially important if using chocolate, since it will melt).
 
Pour the liquid ingredients into the dry ingredients. Use a big spoon to mix them together until the two are evenly combined and no dry oats remain. This takes some arm muscles, but you can do it! If the mixture was easy to mix together, that’s a sign that you need to add some more oats—sprinkle in more oats until you can’t incorporate any more.
 
Transfer the mixture to the prepared square baker. Use your spoon to arrange the mixture fairly evenly in the baker, then use the bottom of a flat, round surface (like a short, sturdy drinking glass) to pack the mixture down as firmly and evenly as possible.
 
Cover the baker and refrigerate for at least one hour, or preferably overnight. (The oats need time to soak up some of the moisture so they aren’t sticky.) When you’re ready to slice, lift the bars out of the baker by grabbing both pieces of parchment paper on opposite corners. Use a sharp knife to slice the bars into 4 even columns and 4 even rows.
 
Wrap individual bars in plastic wrap or parchment paper (if you store them all together, they will stick to one another). Bars keep well for several days at room temperature, a couple of weeks in the fridge, or several months in a freezer-safe bag in the freezer for best flavor.
","1 ¾ cups old-fashioned oats or quick-cooking oats; 1 teaspoon ground cinnamon; ½ teaspoon fine sea salt (if using regular table salt, scale back a bit); 2 cups mix-ins* (nuts, seeds, chocolate, shredded coconut or dried fruit); 1 cup creamy peanut butter or almond butter; ½ cup honey or maple syrup; 1 teaspoon vanilla extract"
276,Fluffy Whole Wheat Zucchini Bread Pancakes,"In a large bowl, whisk together whole wheat pastry flour, baking powder, cinnamon, nutmeg and salt. In a separate large bowl, combine shredded zucchini, egg, maple syrup, coconut oil, vanilla and almond milk until smooth and well combined. Fold in pecans if using. Add dry ingredients to wet ingredients and mix until just combined. If the batter looks too thick add just a splash more milk. If it’s way to wet, add another tablespoon of flour. Lightly coat a large nonstick skillet or griddle with coconut oil or butter and place over medium heat. Drop batter by 1/3 cup onto skillet and spread out a bit with a spoon if necessary. Cook until bubbles appear on top, about 2 minutes. Flip cakes and cook until golden brown on underside, 2 minutes. Wipe skillet clean and repeat with more coconut oil (or butter) and remaining batter. You may need to reduce the heat after the second batch to prevent burning. Serves 4, 2 pancakes each.","For the dry ingredients:; 1 cup whole wheat pastry flour or white whole wheat flour*; 2 teaspoons baking powder; 1 ¼ teaspoons cinnamon; ¼ teaspoon nutmeg; ¼ teaspoon salt; For the wet ingredients:; 1 heaping cup shredded zucchini, squeezed of excess moisture with a paper towel (from 1 medium zucchini); 1 egg; 2 tablespoons pure maple syrup (or honey); 1 tablespoon melted and cooled coconut oil (or sub melted butter); 1 teaspoon vanilla extract; ½ cup unsweetened vanilla almond milk (or milk of choice); Optional: ¼ cup chopped pecans"
277,Slutty Brownies,"For the Brownie layer: In a medium saucepan, melt the butter over medium high heat. Add the sugar and cocoa powder once the butter is melted. Whisk to combine and remove from heat. Add the salt, vanilla and eggs and continuously whisk until the eggs are combined. Add the flour and continue to mix. Set batter aside. For the Cookie Dough layer: Cream together the butter and sugars in a mixer. Add the egg and vanilla, making sure to scrape down the sides of the mixing bowl. Add the flour, salt, baking soda and baking powder and mix on low until everything is incorporated. Fold in the chocolate chips. Set dough aside. Assembly: Preheat the oven to 350 degrees F and line the bottom of a 9x9 baking pan with tin foil or parchment paper and then spray the foil/paper with a spritz of non-stick baking spray.Layer the cookie dough on the bottom of a 9x9 baking pan, pressing down to form the bottom of the slutty brownies. Layer as many oreos that will fit on top of the cookie dough. No need to overlap. One single layer will do.Pour the brownie batter on top of the oreo layer and make sure it's evenly layers on top.Bake for 35-40 minutes. Test with a knife to see if the center is done. If the knife comes out clean, let the brownies rest for at least 2 hours before serving. If the knife comes out with batter still on it, allow the brownies to bake about 5 minutes more. Slice and serve.",▢ 10 tablespoon unsalted butter; ▢ 1 ¼ cups white sugar; ▢ ¾ cup cocoa powder; ▢ ½ teaspoon kosher salt; ▢ 2 teaspoons vanilla extract; ▢ 2 large eggs; ▢ ½ cup flour; ▢ 1 package of Oreo regular stuffed or double stuffed; ▢ ½ cup unsalted butter at room temp; ▢ ¼ cup brown sugar; ▢ ¾ cup white sugar; ▢ 1 egg; ▢ 1 ¼ teaspoons vanilla extract; ▢ 1 ¼ cups flour; ▢ ½ teaspoon salt; ▢ ½ teaspoon baking soda; ▢ ½ teaspoon baking powder; ▢ 1 cup semi-sweet chocolate chips
278,Jalapeño Popper Stuffed Smoked Pork Tenderloin Wrapped in Bacon,"Trim the pork tenderloins of any fat and membrane. Holding knife horizontally, slice the pork tenderloin in half being careful not to pierce through the other end. In a small bowl, mix together the jalapeño pepper with the cream cheese, cheddar cheese and chili powder. Spread the cheese and jalapeño pepper mixture evenly in the openings of the pork tenderloin. Close up the tenderloins ensuring that the cheese stays inside the pocket of the meat. Wrap the tenderloins with the bacon and place on smoker rack. It may be wise to have the tenderloins with the cut open side facing up, so that any melted cheese will stay in the pocket and not ooze out. Set the smoker to 275F using wood of choice (hickory, apple or cherry work great). Smoke the pork until they reach an internal temperature of 165F and the bacon is rendered and starting to crisp, approximately 2 1/2 - 3 hours. Remove the pork tenderloins from the smoker and let them rest for about 10 minutes. Slice into 1 inch medallions and serve.","2 pork tenderloin; 4 jalapeno peppers, cored and minced; 8 oz cream cheese; 1 cup cheddar cheese, grated; 1 tbsp chili powder; 10-12 bacon slices"
279,Smash burgers,"Slice the burger buns in half, then toast or grill the cut sides and set aside. Heat the oven to 100C/80C fan/gas ¼. Divide the mince into four loose piles and season generously with salt. Heat ¼ tbsp oil in a heavy frying pan or skillet over a high heat and put one of the piles in the pan. Working quickly, cover with a square of baking parchment and use a second smaller pan to press the beef patty down as hard as you can (you may wear oven gloves or use the end of a rolling pin for pressing down, being careful of the heat and rising steam). Allow to cook for 2 mins. Remove the parchment and turn the patty over. Press down with a spatula, cover with a slice of cheese and cook for 1 min. Transfer to a baking tray and keep warm in the oven while you cook the other burgers in the same way. To assemble the burger, scatter a bun base with onion, lettuce and tomato slices, followed by a smashed patty, gherkin slices and the bun top. Serve with your chosen sauces on the side.","4 burger buns, sesame topped or brioche, whichever you prefer ; 1 tbsp sunflower oil; 500g steak mince, 15-20% fat is good ; 4 slices mild cheddar, or burger cheese; 1 red onion, finely sliced; handfuls of iceberg lettuce, finely shredded; 2 tomatoes, sliced ; 1 large gherkin, sliced lengthways; mayonnaise, ketchup and American mustard, or your preferred sauces, to serve "
280,Rainbow Grilled Cheese Sandwich,"Gather the ingredients. Divide cheese evenly between 4 bowls. Add a squirt of food coloring to 1 bowl and stir it with a fork until coated and colorful. Repeat this step, using different colors, for each of the other bowls until you have your desired colors. Feel free to go a little wild here and combine colors that are analogous to each other. Add colored cheese to piece of bread, in the form of individual lines so that the colors aren't overlapping. This will create the desired rainbow effect. Once the lines of colored cheese take up the entire surface of the bread, add the other piece of bread on top, close sandwich, and butter the outside. In a medium-sized pan, add buttered grilled cheese and cook for a few minutes until bread turns a golden brown and all the cheese has begun to melt. Flip sandwich and repeat until both sides are golden brown and all the cheese has melted. Remove from heat, cut against your original cheese lines, and serve.",2 slices bread; 1/3 cup shredded white cheese; 1 package neon food coloring; 1 tablespoon salted butter
281,Watermelon Salad,"In a small bowl, combine the sliced shallot with the vinegar and fine salt. Toss to combine, and place in the refrigerator to lightly pickle while you prepare the remaining ingredients (at least 10 minutes). Spread the cubed watermelon over a large platter or shallow serving bowl. Arrange the pickled shallot on top, and spoon the leftover vinegar over the salad. Sprinkle the feta and pistachios on top.  Drizzle the olive oil all over. Finish the salad with a sprinkle of fresh herbs and flaky salt. This salad is best enjoyed within an hour or two, but will keep in the refrigerator for up to 4 days.","1 medium-to-large shallot or ½ small red onion, sliced very thinly (about ½ cup); 3 tablespoons sherry vinegar or red wine vinegar; ¼ teaspoon fine salt; 3 pounds ripe seedless watermelon (about ½ small round watermelon or 4 cups cubed), cut into ¾″ cubes; ½ cup crumbled feta (about 2 ounces); ⅓ cup roasted and salted pistachios, chopped; ¼ cup extra-virgin olive oil; Small handful of fresh mint and/or basil leaves, torn if large, for garnish; Flaky salt or kosher salt, to taste"
282,Chocolate Peanut Butter and Jelly Cups,"Line a mini muffin tray with 24 mini muffin liners and make space for it in the fridge. Set aside. Melt Chocolate: Break chocolate (if using a bar) into small pieces. Melt the chocolate in the microwave in 30-second intervals, stirring in between each interval, just until melted. Alternatively, melt over a double boiler. In a medium saucepan, bring about 1 cup of water to simmer over low heat. Place a glass bowl on top of the pot so it rests above the simmering water, but doesn't touch it! Place chocolate chips in the bowl and allow the steam to heat the bowl. Stir occasionally until the chocolate chips are melted. Once melted, turn off the heat. Drizzle 1 tsp of melted chocolate into each mini muffin case. Rotate the muffin tin around to coat the sides of the muffin liner. You can also do this with a spoon. Try to get the chocolate as high as you can get so it can form a shell around the Peanut Butter & Jelly. After you have coated all the liners, transfer the tray to the freezer for about 5 minutes to set. After the shells have hardened, add about ½ tsp of peanut butter into the middle of each case followed by about ½ teaspoon of jelly. Add about 1 tsp of the remaining melted chocolate into each liner, making sure to cover with chocolate. Sprinkle with a pinch of sea salt if desired. Return to the freeze to set for another 5-10 minutes. Enjoy immediately."," 8 oz dark chocolate;  ¼ cup smooth peanut butter;  ¼ cup jelly or jam of choice;  Flaked or coarse salt, optional"
283,Homemade Bread,"Prepare the dough: In a large bowl or stand mixer add the yeast, water and a pinch of the sugar or honey. Allow to rest for 5-10 minutes until foaming and bubbly. (This is called “proofing” the yeast, to make sure it is active. If it doesn’t foam, the yeast is no good, and you need to start over with fresh yeast). Add remaining sugar or honey, salt, oil, and 3 cups of flour. Mix to combine. Add another cup of flour and mix to combine. With the mixer running add more flour, ½ cup at a time, until the dough begins to pull away from the sides of the bowl. The dough should be smooth and elastic, and slightly stick to a clean finger, but not be overly sticky. Add a little more flour, if needed. Knead the dough: Mix the dough for 4-5 minutes on medium speed (or knead with your hands on a lightly floured surface, for 5-8 minutes).  First Rise: Grease a large bowl with oil or cooking spray and place the dough inside, turning to coat. Cover with a dish towel or plastic wrap and allow to rise in a warm place* until doubled in size, about 1 ½ hours. Spray two 9x5'' bread pans generously with cooking spray on all sides. (I also like to line the bottom of the pans with a small piece of parchment or wax paper, but this is optional.) Punch the dough down well to remove air bubbles. Divide into two equal portions. Shape each ball into long logs and place into greased loaf pans. Second rise: Cover pans with a lightweight, dry dish towel (or spray two pieces of plastic wrap generously with cooking spray and lay them gently over the pans). Allow dough to rise again for about 45 minutes to one hour, or until risen about 1 inch above the loaf pans. Gently removing covering. Bake: Preheat oven to 350 F. Bake bread for about 30-33 minutes, or until golden brown on top. Give the top of a loaf a gentle tap; it should sound hollow. Invert the loaves onto a wire cooling rack. Brush the tops with butter and allow to cool for at least 10 minutes before slicing. Once cool, store in an airtight container or bag for 2-3 days at room temperature, or up to 5 days in the refrigerator.",2 cups warm water (105-115 degrees); 1 Tablespoons active dry yeast*; 1/4 cup honey or sugar; 2 teaspoons salt; 2 Tablespoons oil (canola or vegetable); 4 - 5 1/2 cups all-purpose or bread flour*
284,"Grilled Salmon with Avocado Salsa (Healthy, Low-Carb, Paleo, Whole30)","Stir the olive oil, garlic, and spices in a small bowl. Brush or rub salmon with the spice mixture. Heat a large heavy-duty (preferably non-stick) pan or grill medium-high heat. Add salmon to the pan and cook for 5-6 minutes per side. Remove from pan, top with avocado salsa and serve immediately. To make the avocado salsa:Add the avocado, tomato, onion, and cilantro to a large mixing bowl. Drizzle with olive oil, fresh lime juice and a pinch of salt and pepper. Gently mix with a spoon until fully combined. Cover with plastic wrap until ready to serve."," 2 4-6 oz salmon fillets;  2 tablespoons olive oil;  1 clove garlic, minced or crushed;  1/2 teaspoon chili powder;  1/2 teaspoon cumin;  1/2 teaspoon onion powder;  1/4 teaspoon black pepper;  1/4 teaspoon salt;  1 ripe avocado, pitted and diced;  1/2 cup tomato, diced (any type of tomato);  2 tablespoons onion, diced;  2 tablespoons cilantro, minced;  1 tablespoon olive oil;  1 tablespoon lime juice;  salt and pepper, to taste"
285,Claudio's aubergine parmigiana,"Peel the aubergine using a speed-peeler, then very finely slice the skin into matchsticks and reserve for later. Slice the aubergine into ½cm-thick rounds – if you want to be really precise, use a circular cutter (roughly 7cm in diameter) to trim the slices into perfect discs – then season with sea salt. Whisk the eggs in a shallow bowl with a small pinch of salt and black pepper, and put the flour into another shallow bowl. Pour ½cm of olive oil into a large frying pan and heat gently over a medium heat. Working in batches, coat in the aubergine discs in flour, shaking off any excess, then gently drop into the beaten egg, letting any excess drip off, and carefully place into the hot oil. Fry for 3 to 4 minutes on each side, or until golden and crisp, then remove to kitchen paper to drain, and repeat with the remaining discs. For the tomato sauce, drizzle 1 tablespoon of olive oil into a pan over a medium heat. Peel and finely slice the garlic, along with the basil stalks and fry for 2 minutes, or until lightly golden. Scrunch the tomatoes into the pan through your clean hands, then season to perfection with a pinch of salt and pepper. Bring to the boil, then turn the heat down to low and simmer for 10 to 15 minutes, or until thickened and reduced. Finely slice half the basil leaves and stir them through the sauce a few minutes before the end, then remove from the heat and season to taste. When the aubergine discs are all fried, turn the heat up to high and fry the aubergine skin for 1 to 2 minutes, or until super-crisp, then drain on kitchen paper. Preheat the oven to 180ºC/350ºF/gas 4. To assemble, get yourself 4 small ovenproof dishes. Peel, then slice the scamorza into ½cm-thick slices. Add a spoonful of sauce to the bottom of each dish, place a slice of aubergine on top, followed by spoon of tomato sauce, a slice of scamorza and a little buffalo mozzarella. Sprinkle with a little oregano, and tear over a few basil leaves. Repeat the layers twice more, finishing with a layer of aubergine and a good grating of Parmesan. Bake for 10 to 12 minutes, or until the cheese has melted and is golden and bubbling. Serve the Parmigiana with the crispy aubergine skin sprinkled over the top and a drizzle of extra virgin olive oil.","1 large aubergine , (400g); 2 large free-range eggs; 50 g plain flour; olive oil; 150 g scamorza , (smoked mozzarella); 50 g buffalo mozzarella; 1 teaspoon dried oregano; 40 g Parmesan cheese; extra virgin olive oil; TOMATO SAUCE; 2 cloves of garlic; 1 bunch of fresh basil , (30g); 1 x 400 g tin of quality plum tomatoes"
286,Easy Pesto Chicken and VegetablesBlack Bean ChiliOne Pot Cheeseburger PastaCurried Chickpeas with SpinachPork and Peanut Dragon NoodlesOne Pot Beef StroganoffBeef and Cabbage Stir FrySouthwest Chicken SkilletBacon and Spinach Pasta with ParmesanSheet Pan Kielbasa Potatoes and Green BeansEasy Rosemary Garlic White Bean SoupOne Pot Sausage and Sun Dried Tomato PastaBlackened Salmon with ZucchiniCreamy Tomato and Spinach PastaVegan Creamy Mushroom RamenCajun Sausage and Rice SkilletEggplant Mozzarella SandwichesGarlic Noodles with Beef and BroccoliPasta with Bacon and Peas,"Bring a pot of water to a boil for the pasta. Once boiling, add the pasta and continue to boil until the pasta is tender (7-10 minutes). Reserve about a half cup of the starchy pasta water before draining the pasta in a colander. While the pasta is boiling, cook the bacon. Add the bacon to a large skillet and cook over medium heat until brown and crispy. Transfer the cooked bacon to a paper towel lined plate with a slotted spoon. Drain most of the bacon grease from the pan, leaving about 2 Tbsp. While the bacon is cooking, finely dice the onion. Add the diced onion to the remaining bacon grease and sauté until tender (about 5 minutes). Add the frozen peas and about ¼ cup of the reserved pasta water to the skillet. Continue to cook and stir until the peas have heated through. Add the drained pasta to the skillet, stir to combine, and remove from the heat. Top the pasta with Parmesan, salt, pepper, crushed red pepper, and crumbled bacon. Stir to combine. Taste and adjust the salt and pepper to your liking. ",8 oz. pasta*; 6 oz. bacon; 1 small onion; 1 cup frozen peas; 1/4 cup grated Parmesan; 1/4 tsp salt; 1/4 tsp freshly cracked black pepper; 1/8 tsp crushed red pepper (optional)
287,Garlic Shrimp Foil Packs,"Add all the ingredients to a large bowl. Mix to combine. Place four 18×12-inch pieces of heavy aluminum foil on counter. Place the shrimp and veggie mixture on the foil. Fold the foil over the shrimp to seal. Grill or bake at 400 degrees for 15-20 minutes or until shrimp and vegetables are cooked through. Serve with rice, bread or salad."," 1 pound large shrimp, peeled and deveined;  3-4 cups chopped zucchini, or your favorite vegetables;  4 cloves garlic, minced;  2 tablespoons minced cilantro, or parsley;  3 Tablespoons olive oil;  1 teaspoon paprika;  Salt and Pepper"
288,Greek salad,"I think it’s quite nice to have different shapes and sizes in a salad, so cut your medium tomato into wedges, halve the cherry tomatoes and slice the beef tomato into large rounds. Put all the tomatoes into a large salad bowl. Slice the onion very finely so it’s wafer thin and add to the tomatoes. Scratch a fork down the sides of the cucumber so it leaves deep grooves in the skin, then cut it into thick slices. Deseed your pepper, slice it into rings and add them to the salad along with the cucumber. Roughly chop the dill and most of the mint leaves, reserving the smaller ones for garnish. Add the chopped herbs to the bowl of salad, then squeeze your handful of olives over so they season the vegetables, then drop them in. Add a pinch of sea salt, the vinegar and the extra virgin olive oil. Quickly toss everything together with your hands. The minute all those flavours start working with the veg is when the magic starts to happen. Have a taste, and adjust the flavours if need be. To serve, pop the block of feta right on the top of the salad. Sprinkle the oregano over the top along with the reserved mint leaves, drizzle with extra virgin olive oil and take it straight to the table. It’s confident and scruffy with a bit of attitude. Delicious. PS I’ve been known to pop leftover Greek salad into a liquidizer with a splash of extra virgin olive oil and a few ice cubes, then blitz it up to a smooth consistency so it's basically a Greek gazpacho. It’s not a classic thing to do, but it is very delicious, not to mention a great way of using up leftovers!","1 medium ripe tomato; 200 g ripe cherry tomatoes; 1 beef tomato; 1 medium red onion , peeled; 1 cucumber; 1 green pepper; 1 handful fresh dill; 1 handful fresh mint leaves; 1 large handful black olives , stoned; 1 tablespoon red wine vinegar; 3 tablespoons good-quality Greek extra virgin olive oil; 200 g block feta cheese; 1 teaspoon dried oregano"
289,Southwestern Chicken & Rice Foil Packets,"Pre-heat oven to 400F. Line a baking sheet with 3 sheets of foil (about 6-8 inches) and set aside. Combine the brown rice, water and 2 tablespoons taco seasoning in a medium bowl and soak for 5 minutes. DIvide rice (and it's water) into 3 sheets of foil. Pound chicken with a meat tenderizer or a rolling-pin until they are even. Seasoning each chicken breast generously with the reaming taco seasoning. Place the chicken on the rice. Top each chicken with a few tablespoons of salsa and a sprinkle of cheese. Add the veggies and beans on the sides of the chicken. Drizzle each packet with olive oil and fold the sides of the foil over the chicken, covering completely; seal the packets closed. Bake for 30-35 minutes, or until chicken's internal temperature reaches 165F. Remove from oven and carefully open up the foils; put the packets under the broiler for 3 to 4 minutes. Squeeze fresh lime juice on each packet, garnish with cilantro and sour-cream if desired and serve."," 3 4 oz chicken breasts, boneless skinless;  1 cup quick brown rice, or white;  1 cup water;  2 tablespoons taco seasoning, 1 packet, see note below;  1/3 cup salsa;  1/2 cup mozzarella or cheddar cheese;  1 cup bell pepper, sliced into thin strips;  1/4 cup onion, sliced into thin strips;  1/2 cup black beans;  1 tablespoon olive oil;  1 lime cut into wedges, optional"
290,Starbucks Potato Cheddar and Chive Bakes,"Preheat the oven to 325°F.Add the potatoes to a small saucepan and cover with water. Add 1 teaspoon of the salt. Bring the water to a boil, and cook until the potatoes are tender, 10 to 12 minutes. Drain and set aside to cool.Add the eggs, butter, cottage cheese, onion powder, vinegar, hot sauce, mustard, and the remaining 1/4 teaspoon salt to a blender. Blend on high for 20 seconds or until well combined.In a small bowl, mix together the Gruyere, Jack and white cheddar cheeses.Divide the cooled potatoes, cheese mixture, and chopped spinach amongst the cups in a greased muffin pan. Add the egg mixture. Top each cup with cheddar cheese and chives.Bake for 25 to 30 minutes, until the muffins puff up and the eggs are cooked through.Let cool for 5 minutes before removing from the muffin pan.",2 cups diced red potatoes; 1 1/4 teaspoons salt divided; 8 large eggs; 2 teaspoons butter; 1/2 cup cottage cheese; 1/2 teaspoon onion powder; 1/4 teaspoon distilled vinegar; 1/4 teaspoon hot sauce; 1/4 teaspoon Dijon mustard; 2 tablespoons shredded Gruyere cheese; 2 tablespoons shredded Monterey Jack cheese; 2 tablespoons shredded white cheddar cheese; 1/4 cup finely chopped spinach; 3/4 cup shredded cheddar cheese; 1 tablespoon chopped chives
